{
    "version": 2,
    "title": "Exemplo PBL teórico: interpretação de texto normativo",
    "pedagogia": {
        "abordagem": "pbl",
        "modalidadeAplicacao": "analitica",
        "problemaId": "problema-00-norma-demo-1",
        "objetivos": ["Comparar interpretações de um texto normativo fictício"],
        "fontes": ["fonte-manual-ficticio"]
    },
    "slides": [
        {
            "title": "Problema: duas leituras da mesma norma fictícia",
            "blocks": [
                {
                    "type": "problema",
                    "contexto": "Duas equipes interpretam de forma diferente o mesmo artigo fictício sobre prazos.",
                    "questao": "Quais critérios tornam uma interpretação mais consistente que a outra?"
                }
            ]
        },
        {
            "title": "Hipóteses iniciais",
            "blocks": [
                {
                    "type": "hipoteses",
                    "items": ["O prazo conta da publicação fictícia.", "O prazo conta da ciência comprovada no cenário."]
                }
            ]
        },
        {
            "title": "Investigação orientada",
            "blocks": [
                {
                    "type": "investigacao",
                    "texto": "Compare os trechos indicados no manual fictício e anote os critérios usados por cada equipe."
                }
            ]
        },
        {
            "title": "Conceito: interpretação sistemática",
            "blocks": [
                {
                    "type": "conceito",
                    "items": ["Ler o artigo no contexto do capítulo fictício.", "Priorizar a finalidade declarada da norma fictícia."]
                }
            ]
        },
        {
            "title": "Aplicação analítica",
            "blocks": [
                {
                    "type": "aplicacao",
                    "modalidade": "analitica",
                    "texto": "Analise os dois pareceres fictícios e indique qual interpretação está mais bem fundamentada, sem executar nenhuma tarefa operacional."
                }
            ]
        },
        {
            "title": "Síntese",
            "blocks": [
                {
                    "type": "sintese",
                    "texto": "A interpretação mais consistente combina texto, contexto e finalidade declarada no cenário fictício."
                }
            ]
        }
    ]
}
