{
    "version": 2,
    "title": "Aula demo 03 - Estrutura de página",
    "pedagogia": {
        "abordagem": "pbl",
        "modalidadeAplicacao": "pratica",
        "problemaId": "problema-03-catalogo-demo-1",
        "objetivos": ["Organizar conteúdo com estrutura semântica"],
        "fontes": ["fonte-plano-curso-ficticio"]
    },
    "slides": [
        {
            "title": "Problema fictício: catálogo desorganizado",
            "blocks": [
                {
                    "type": "problema",
                    "contexto": "O catálogo fictício mistura título e descrição dos produtos, dificultando a leitura.",
                    "questao": "Como separar título e descrição de um produto fictício para facilitar a leitura?"
                }
            ]
        },
        {
            "title": "Conceito: estrutura semântica",
            "blocks": [
                {
                    "type": "conceito",
                    "items": ["Títulos organizam a hierarquia do documento.", "Parágrafos agrupam a descrição do produto fictício."]
                }
            ],
            "notes": "Material fictício para validar o pipeline. Não é evidência de aprendizagem."
        },
        {
            "title": "Aplicação prática",
            "blocks": [
                {
                    "type": "aplicacao",
                    "modalidade": "pratica",
                    "texto": "Construa uma página sintética aplicando a estrutura semântica ao catálogo fictício.",
                    "codigo": "<article>\n    <h2>Produto demo</h2>\n    <p>Descrição sintética.</p>\n</article>",
                    "demonstracao": {
                        "texto": "Referência oficial: elemento article",
                        "url": "https://html.spec.whatwg.org/multipage/sections.html#the-article-element"
                    }
                }
            ]
        },
        {
            "title": "Síntese",
            "blocks": [
                {
                    "type": "sintese",
                    "items": ["Estrutura semântica separa título e descrição.", "A mesma estratégia vale para outros catálogos fictícios."]
                }
            ]
        }
    ]
}
